id,name,email,role,tech_stack,score,breakdown,created_at
20250827194004,fgf  fg,sad@gmail.com,SDE,"assa,fd,gh",0,"[{""question"": ""Describe the difference between a linked list and a binary search tree in terms of memory management and search performance."", ""answer"": ""sdfaaaaaa\\"", ""justification"": ""The linked list stores the data elements sequentially, while the binary search tree organizes them based on a specific key. This allows binary search to perform a search operation much faster than searching a linked list."", ""score"": 0}, {""question"": ""Explain the purpose of using threads in a multi-threaded programming environment. Give an example of when using threads would be beneficial."", ""answer"": ""dggggggggg"", ""justification"": ""**Justification:** Threads allow multiple threads to execute concurrently, improving performance by reducing waiting time between tasks. This is beneficial when dealing with tasks that take significan"", ""score"": 0}, {""question"": ""Discuss the difference between static and dynamic typing in languages like Python and Java. Give examples of when each type is used."", ""answer"": ""djjjjjjjjjjjjj"", ""justification"": ""The difference between static and dynamic typing lies in the ability of the compiler to determine the type of variables at compile time vs. runtime."", ""score"": 0}, {""question"": ""Explain the difference between a mutex and a semaphore in terms of their functionality and use cases."", ""answer"": ""jjjjjjjjjjjjjjj"", ""justification"": ""A mutex (mutual exclusion) restricts only one thread at a time from accessing a shared resource, while a semaphore restricts only a specified number of threads."", ""score"": 0}, {""question"": ""Describe the difference between a TCP and a UDP socket and give an example of when each is used."", ""answer"": ""lllllllllllllllll"", ""justification"": ""A TCP socket is a two-way communication channel that establishes a connection between two endpoints, while a UDP socket is a one-way communication channel that allows data to be sent from a source to a destination."", ""score"": 0}, {""question"": ""Explain the difference between a hash table and a linked list in terms of data structure and how they are used for different purposes."", ""answer"": ""ffffffffffffffff"", ""justification"": ""A hash table is a data structure that uses a hash function to map keys to specific positions in an array. Linked lists are a data structure that uses pointers to link nodes together in a linear chain."", ""score"": 0}, {""question"": ""Discuss the concept of garbage collection in languages like Python and how it affects memory management."", ""answer"": ""yyyyyyyyyyyyyyyyyy"", ""justification"": ""**Justification:** The candidate's answer provides a basic overview of garbage collection but lacks depth and fails to address the specific concept of garbage collection in languages like Python.\n\n**S"", ""score"": 0}, {""question"": ""Describe the difference between a compiler and an assembler and give an example of each."", ""answer"": ""sssssssssssssssss"", ""justification"": ""A compiler is a program that translates high-level source code into a low-level executable code, while an assembler is a program that translates assembly code into machine code."", ""score"": 0}, {""question"": ""Explain the difference between a virtual machine and a physical machine in terms of their architecture and how they are used for different purposes."", ""answer"": ""uuuuuuuuuuuuuu"", ""justification"": ""A virtual machine (VM) is a software-based emulation of a physical computer system. It shares the operating system kernel and essential hardware resources with the guest operating system, while the guest OS runs in a protected environment. VMs offer virtual memory, allowing multiple running programs to share the same physical memory. This enables efficient utilization of hardware resources and provides a consistent environment for different applications."", ""score"": 0}, {""question"": ""Discuss the concept of polymorphism and how it is achieved in languages like Java and Python."", ""answer"": ""xxxxxxxxxxxx"", ""justification"": ""**Justification:** The candidate's answer provides a basic definition of polymorphism but lacks depth and fails to explain how it is achieved in languages like Java and Python.\n\n**Score:** 6/10"", ""score"": 0}]",2025-08-27T19:41:42.138722
20250827203315,asda dfd,sdas@gmail.com,SDE,"python,sql,html,css,java",0,"[{""question"": ""Explain the difference between SQL and Python in terms of data manipulation and retrieval."", ""answer"": ""asdasda"", ""justification"": ""The candidate's answer is not informative and does not provide any distinction between SQL and Python in terms of data manipulation and retrieval."", ""score"": 0}, {""question"": ""Describe a scenario where you would use SQL to perform a complex data analysis on a large dataset."", ""answer"": ""dsasd"", ""justification"": ""**Justification:** The candidate's answer provides a basic description of SQL data analysis, but it lacks the depth and complexity required for a complete answer.\n\n**Score:** 5/10"", ""score"": 0}, {""question"": ""How would you design a basic web application using HTML, CSS, and JavaScript that allows users to input and display data?"", ""answer"": ""asdasd"", ""justification"": ""**Justification:** The candidate's answer is factually correct, but it is lacking in detail and organization. It does not provide any specific guidance on how to implement the required functionalities"", ""score"": 0}, {""question"": ""Explain the purpose of object-oriented programming and how it can be used to design a scalable and maintainable software system."", ""answer"": ""asdasd"", ""justification"": ""**Justification:** Object-oriented programming (OOP) promotes code reusability, modularity, and maintainability by encapsulating data and methods within objects. This allows developers to create loose"", ""score"": 0}, {""question"": ""Describe a common algorithm for solving a specific problem in Python, such as finding the minimum value in a list."", ""answer"": ""asdas"", ""justification"": ""**Justification:** The candidate's answer is factually correct, but it could be improved in terms of clarity and conciseness.\n\n**Score:** 7/10"", ""score"": 0}, {""question"": ""Explain the difference between static and dynamic programming and provide an example of each."", ""answer"": ""asdas"", ""justification"": ""Static and dynamic programming are two different techniques used in computer science to solve problems by breaking them down into smaller subproblems."", ""score"": 0}, {""question"": ""Describe how you would implement a connection pool in Python to efficiently manage database connections."", ""answer"": ""asdsas"", ""justification"": ""**Justification:** The candidate's answer is factually correct, but it could be improved in terms of clarity and organization.\n\n**Score:** 7/10\n\n**Additional Feedback:**\n\n* The candidate could provide"", ""score"": 0}, {""question"": ""Explain the principles of SOLID architectural pattern and how it can be applied to a Python project."", ""answer"": ""sdas"", ""justification"": ""**Justification:** The candidate's answer provides a basic overview of the SOLID architectural pattern, but it lacks depth and fails to explain how it applies to a Python project.\n\n**Score:** 5/10\n\n**"", ""score"": 0}, {""question"": ""Describe a common design pattern for handling exceptions in Python and how it can be used to improve code robustness."", ""answer"": ""as"", ""justification"": ""The exception handling pattern in Python utilizes a try-except block to capture and handle exceptions raised during the code execution. This pattern allows developers to define specific exception types to be handled, providing a structured approach to error handling."", ""score"": 0}, {""question"": ""How would you optimize the performance of a Python script that performs a lot of data processing?"", ""answer"": ""sad"", ""justification"": ""**Justification:** The candidate's answer is incomplete and does not provide any insights into the optimization of a Python script for data processing.\n\n**Score:** 3/10"", ""score"": 0}]",2025-08-27T20:35:02.909173
20250827204435,simran ulli,simran@gmail.com,ML engineer,"python,tensorflow,nlp",0,"[{""question"": ""**Explain the difference between TensorFlow and NLTK libraries in the context of machine learning.**"", ""answer"": ""**TensorFlow** is a deep learning framework used for building and training neural networks and complex ML models, while **NLTK (Natural Language Toolkit)** is a specialized library for natural language processing tasks like tokenization, stemming, and parsing text.\n"", ""justification"": ""**Justification:** The candidate's answer provides a basic distinction between TensorFlow and NLTK, but it lacks details and may not cover all the key differences between the two libraries.\n\n**Score:*"", ""score"": 0}, {""question"": ""**Describe a scenario where you would use the TF-IDF algorithm to analyze a large dataset of text documents.**"", ""answer"": ""You would use **TF-IDF** when building a **search engine for news articles**: it helps identify the most important words in each article by reducing the weight of common terms (like *the* or *and*) and highlighting unique, meaningful terms, improving the relevance of search results when users query the dataset.\n"", ""justification"": ""The TF-IDF algorithm helps identify the most important words in each article by reducing the weight of common terms and highlighting unique, meaningful terms, improving the relevance of search results when users query the dataset."", ""score"": 0}, {""question"": ""**How would you implement a basic sentiment analysis pipeline using NLP and how would you evaluate its performance?**"", ""answer"": ""A **basic sentiment analysis pipeline** can be implemented as follows:\n\n1. **Data Collection** → Gather labeled text data (e.g., positive/negative reviews).\n2. **Preprocessing** → Clean text (lowercasing, removing stopwords, tokenization, stemming/lemmatization).\n3. **Feature Extraction** → Convert text to numerical features using **Bag of Words** or **TF-IDF**.\n4. **Model Training** → Train a classifier (e.g., Logistic Regression, Naive Bayes, or an LSTM/Transformer model for deep learning).\n5. **Prediction** → Classify new text as positive, negative, or neutral.\n\n**Evaluation**: Use metrics like **accuracy, precision, recall, F1-score, and confusion matrix**; for imbalanced data, also consider **ROC-AUC score**.\n"", ""justification"": ""The answer provides a basic overview of the sentiment analysis pipeline, but it lacks details about the specific techniques and steps involved in each stage."", ""score"": 0}, {""question"": ""**Explain the role of data cleaning and feature engineering in data preparation for machine learning tasks.**"", ""answer"": ""**Data cleaning** ensures the dataset is accurate and usable by handling missing values, removing duplicates, correcting errors, and dealing with outliers.\n\n**Feature engineering** transforms raw data into meaningful inputs for models by creating new features, encoding categorical variables, scaling/normalizing values, and selecting the most relevant features—ultimately improving model performance and accuracy.\n"", ""justification"": ""The answer provides a basic overview of data cleaning and feature engineering, but it lacks specific details and examples."", ""score"": 0}, {""question"": ""**How would you handle missing values and outliers in a dataset while performing data analysis?**"", ""answer"": ""* **Handling Missing Values**:\n\n  * Remove rows/columns if too many values are missing.\n  * Impute with mean/median/mode (for numerical/categorical data).\n  * Use advanced methods like **KNN imputation** or model-based imputation.\n\n* **Handling Outliers**:\n\n  * Detect using statistical methods (IQR, Z-score) or visualization (boxplot, scatterplot).\n  * Treat by capping values, transforming data (log, sqrt), or removing extreme cases if they are errors.\n  * Keep them if they represent true, meaningful variation in the data.\n"", ""justification"": ""Missing values and outliers should be handled based on their impact on the analysis. Missing values can be removed or imputed, while outliers should be detected and addressed according to their type and impact."", ""score"": 0}, {""question"": ""**Discuss the importance of regularization techniques in preventing overfitting and how you would implement L1 and L2 regularization in TensorFlow.**"", ""answer"": ""Regularization prevents overfitting by penalizing overly complex models, forcing them to generalize better instead of memorizing training data. It works by adding a penalty term to the loss function, discouraging large weights."", ""justification"": ""## Justification:\n\n* The candidate's answer correctly defines overfitting as the problem of a model memorizing training data instead of generalizing to new data.\n* The candidate provides a clear and c"", ""score"": 0}, {""question"": ""**Describe a common optimization algorithm used in machine learning and explain its key features.**"", ""answer"": ""A common optimization algorithm in machine learning is **Stochastic Gradient Descent (SGD)**.\n\n* **Key Features**:\n\n  * Updates model parameters iteratively using the gradient of the loss function.\n  * Uses a **learning rate** to control step size.\n  * Instead of the whole dataset, it updates weights using small random batches, making it faster and more scalable.\n  * Variants like **SGD with Momentum**, **Adam**, and **RMSprop** improve convergence and stability.\n"", ""justification"": ""A common optimization algorithm in machine learning for regression and classification tasks, SGD, iteratively updates model parameters using the gradient of the loss function."", ""score"": 0}, {""question"": ""**What are the different types of neural networks and their suitability for different machine learning tasks?**"", ""answer"": ""Feedforward Neural Network (FNN/ANN) → Basic fully connected network; suitable for structured/tabular data and simple classification/regression tasks.\n\nConvolutional Neural Network (CNN) → Uses convolutional layers to detect spatial patterns; best for image recognition, object detection, video analysis.\n\nRecurrent Neural Network (RNN) → Processes sequential data with memory of previous inputs; used for time series forecasting, speech recognition, natural language processing.\n\nLong Short-Term Memory (LSTM) / GRU → Advanced RNNs that handle long-term dependencies; effective for text generation, translation, sentiment analysis.\n\nGenerative Adversarial Network (GAN) → Consists of a generator and discriminator; used for image generation, data augmentation, deepfake creation.\n\nRadial Basis Function Network (RBFN) → Uses radial basis functions as activation; suitable for function approximation and classification.\n\nTransformer Networks → Attention-based models; state-of-the-art for NLP tasks, machine translation, and large language models."", ""justification"": ""The answer provides a basic overview of the different types of neural networks and their suitability for different machine learning tasks, but it lacks specific details and examples."", ""score"": 0}, {""question"": ""**Explain the difference between gradient descent and stochastic gradient descent and provide an example of each.**"", ""answer"": ""**Gradient Descent (GD)** computes the gradient of the loss function using the **entire dataset** to update model parameters, ensuring stable convergence but can be slow on large datasets.\n\n* **Example**: Training a linear regression model on 100,000 rows by computing the gradient over all rows before each update.\n\n**Stochastic Gradient Descent (SGD)** updates parameters **using one sample or a small batch** at a time, making it faster and suitable for large datasets, but the updates are noisier.\n\n* **Example**: Training the same linear regression model by updating weights after each individual data point or mini-batch of 32 samples.\n"", ""justification"": ""Gradient descent computes the gradient of the loss function using the entire dataset, ensuring stable convergence but can be slow on large datasets. Stochastic gradient descent updates parameters using one sample or a small batch at a time, making it faster and suitable for large datasets, but the updates are noisier."", ""score"": 0}, {""question"": ""**Describe the role of hyperparameter tuning in optimizing the performance of a machine learning model.**"", ""answer"": ""**Hyperparameter tuning** involves selecting the best values for parameters that are not learned during training (e.g., learning rate, number of layers, regularization strength, batch size) to **maximize model performance**, improve generalization, and prevent overfitting or underfitting.\n\nCommon tuning methods include **grid search, random search, and Bayesian optimization**.\n"", ""justification"": ""Hyperparameter tuning involves selecting the best values for parameters that are not learned during training to maximize model performance, improve generalization, and prevent overfitting or underfitting."", ""score"": 0}]",2025-08-27T20:49:46.456121
20250828112316,abhishek dongre,abhishek@gmail.com,SDE,python,34,"[{""question"": ""Describe the difference between a variable and a constant in the context of the Python language."", ""answer"": ""In Python, a variable is a named storage that can hold data and be reassigned to different values during program execution, while a constant is a value meant to remain unchanged throughout the program, usually indicated by naming it in uppercase letters by convention since Python does not enforce true constants."", ""justification"": ""Keyword overlap: 0.33, Similarity: 0.19, Combined: 0.249 => score 2.49/10"", ""score"": 2.49}, {""question"": ""Explain the purpose of using a virtual environment in Python development."", ""answer"": ""A virtual environment in Python is used to create an isolated workspace where dependencies and packages can be installed without affecting the system-wide Python or other projects, helping manage different project requirements and avoid version conflicts."", ""justification"": ""Keyword overlap: 0.50, Similarity: 0.18, Combined: 0.311 => score 3.11/10"", ""score"": 3.11}, {""question"": ""What are the different types of data structures in Python, and how would you choose the right one for a specific task?"", ""answer"": ""Python provides several data structures such as lists, tuples, sets, and dictionaries; lists are used for ordered and mutable collections, tuples for ordered and immutable collections, sets for unique and unordered elements, and dictionaries for key-value pairs; the right choice depends on the task, for example using a list for dynamic sequences, a tuple for fixed data, a set for membership checks, and a dictionary for fast lookups by key."", ""justification"": ""Keyword overlap: 0.33, Similarity: 0.29, Combined: 0.306 => score 3.06/10"", ""score"": 3.06}, {""question"": ""Explain the difference between recursion and iteration in Python."", ""answer"": ""Recursion is when a function calls itself to solve a problem by breaking it into smaller subproblems, while iteration uses loops like for or while to repeatedly execute a block of code until a condition is met."", ""justification"": ""Keyword overlap: 0.33, Similarity: 0.06, Combined: 0.168 => score 1.68/10"", ""score"": 1.68}, {""question"": ""Describe the basic syntax of a function in Python, including arguments, return type, and scope."", ""answer"": ""In Python, a function is defined using the def keyword followed by the function name and parentheses containing arguments, the function body is indented, it can return values using the return statement, and variables defined inside the function have local scope while those defined outside have global scope."", ""justification"": ""Keyword overlap: 0.50, Similarity: 0.35, Combined: 0.407 => score 4.07/10"", ""score"": 4.07}, {""question"": ""Explain the difference between a class and a module in Python, and how they are used together."", ""answer"": ""A class in Python is a blueprint for creating objects that bundle data and methods, while a module is a file containing Python code such as functions, classes, and variables that can be imported into other programs; they are often used together when a class is defined inside a module and then imported and reused in different parts of a project."", ""justification"": ""Keyword overlap: 0.33, Similarity: 0.37, Combined: 0.358 => score 3.58/10"", ""score"": 3.58}, {""question"": ""Discuss the use of exceptions in Python, including try, except, and finally blocks."", ""answer"": ""Exceptions in Python are used to handle errors gracefully without stopping program execution; the try block contains code that might raise an error, the except block defines what to do if a specific error occurs, and the finally block contains code that will always run regardless of whether an exception was raised or not, often used for cleanup actions like closing files or releasing resources."", ""justification"": ""Keyword overlap: 0.50, Similarity: 0.21, Combined: 0.325 => score 3.25/10"", ""score"": 3.25}, {""question"": ""Describe the concept of inheritance in Python, including base class and derived class."", ""answer"": ""Inheritance in Python allows a derived class to reuse and extend the properties and methods of a base class, where the base class provides common functionality and the derived class can override or add new features, promoting code reuse and easier maintenance."", ""justification"": ""Keyword overlap: 0.50, Similarity: 0.55, Combined: 0.529 => score 5.29/10"", ""score"": 5.29}, {""question"": ""Explain the principles of object-oriented programming in Python, including encapsulation, inheritance, and polymorphism."", ""answer"": ""Object-oriented programming in Python is based on encapsulation, inheritance, and polymorphism; encapsulation means bundling data and methods inside classes while restricting direct access to internal details, inheritance allows a class to derive and reuse functionality from another class, and polymorphism enables different classes to define methods with the same name but different behaviors, allowing flexible and reusable code."", ""justification"": ""Keyword overlap: 0.67, Similarity: 0.33, Combined: 0.462 => score 4.62/10"", ""score"": 4.62}, {""question"": ""Describe the use of libraries like NumPy and Pandas for data manipulation and analysis in Python."", ""answer"": ""NumPy is used for fast numerical computing with support for arrays, matrices, and mathematical operations, while Pandas is built on top of NumPy and provides data structures like Series and DataFrame that make it easier to clean, manipulate, and analyze structured data efficiently."", ""justification"": ""Keyword overlap: 0.17, Similarity: 0.34, Combined: 0.274 => score 2.74/10"", ""score"": 2.74}]",2025-08-28T11:26:46.174217
