id,name,email,role,tech_stack,score,breakdown,created_at
20250827161844,abhishek dongre,abdas@gmail.com,SDE,"python,sql",18,"[{""question"": ""Explain the difference between a relational database and a NoSQL database, and give an example of each."", ""answer"": ""A relational database stores structured data in tables with predefined schemas and supports SQL (e.g., **MySQL**), while a NoSQL database stores unstructured/semi-structured data in flexible formats like key-value, document, or graph (e.g., **MongoDB**)."", ""justification"": ""The candidate's answer provides a basic definition of relational and NoSQL databases, but it lacks specific details and lacks a clear distinction between the two."", ""score"": 5.0}, {""question"": ""Describe the different components of a SQL query, including the SELECT, FROM, WHERE, and ORDER BY clauses."", ""answer"": ""* **SELECT** → specifies the columns or expressions to retrieve.\n* **FROM** → defines the table(s) from which to fetch data.\n* **WHERE** → filters rows based on conditions.\n* **ORDER BY** → sorts the result set in ascending or descending order."", ""justification"": ""The candidate's answer covers the basic components of a SQL query, including SELECT, FROM, WHERE, and ORDER BY."", ""score"": 8.0}, {""question"": ""How would you design a database schema for a web application that allows users to create, edit, and delete posts?"", ""answer"": ""do no"", ""justification"": ""**Justification:** The candidate's answer does not provide any information about the design of a database schema for a web application that allows users to create, edit, and delete posts.\n\n**Score:** "", ""score"": 0.0}, {""question"": ""Explain the difference between a function and a class in Python, and give an example of each."", ""answer"": ""don't know"", ""justification"": ""A function is a block of code that contains a set of instructions that perform a specific task. A class is a blueprint that defines the structure and behavior of an object. Both are used to create objects that have their own set of attributes and methods."", ""score"": 5.0}, {""question"": ""Describe a common algorithm for solving a given problem, such as the bubble sort algorithm or the merge sort algorithm."", ""answer"": ""don't know"", ""justification"": ""**Justification:** The candidate's answer is completely irrelevant to the question. It provides no insights into the problem-solving process or the algorithm itself.\n\n**Score:** 0/10"", ""score"": 0.0}, {""question"": ""How would you implement a connection pool in Python to handle multiple database connections?"", ""answer"": ""don't know"", ""justification"": ""**Justification:** The candidate's answer is completely irrelevant to the question.\n\n**Score:** 0/10"", ""score"": 0.0}, {""question"": ""Explain the difference between a thread and a process in Python, and give an example of each."", ""answer"": ""don't know"", ""justification"": ""**Justification:** The candidate's answer is incomplete and does not provide any information about the difference between threads and processes in Python.\n\n**Score:** 3/10"", ""score"": 0.0}, {""question"": ""Describe the principles of system design and give an example of how you would apply them to a Python application."", ""answer"": ""don't know"", ""justification"": ""**Justification:** The candidate's answer demonstrates a lack of understanding of the principles of system design. The candidate refers to a general concept called \""system design\"" without providing an"", ""score"": 0.0}, {""question"": ""Give an example of a common error handling technique in Python, and explain how it can be used to improve the robustness of a program."", ""answer"": ""don't know"", ""justification"": ""**Justification:** The candidate's answer demonstrates a lack of understanding of common error handling techniques in Python.\n\n**Score:** 3/10\n\n**Additional Feedback:**\n\n* A clear explanation of the d"", ""score"": 0.0}, {""question"": ""Describe the difference between a virtual environment and a virtual machine, and give an example of each."", ""answer"": ""don't know"", ""justification"": ""**Justification:** The candidate's answer is completely unrelated to the question.\n\n**Score:** 3/10"", ""score"": 0.0}]",2025-08-27T16:21:49.203756
20250827182720,Akash Dongre,akashdongre@gmail.com,front end developer,"html,css,bootstrap",52,"[{""question"": ""Explain the difference between HTML and CSS in the context of front-end development."", ""answer"": ""**HTML** defines the structure and content of a webpage (headings, paragraphs, images, links), while **CSS** controls its presentation and styling (colors, layout, fonts, spacing).\n"", ""justification"": ""The candidate's answer provides a basic distinction between HTML and CSS, but it lacks depth and fails to explain the relationship between them."", ""score"": 5.0}, {""question"": ""Describe the purpose of JavaScript and how it interacts with HTML and CSS."", ""answer"": ""**JavaScript** adds interactivity and dynamic behavior to web pages by manipulating **HTML** (content/structure) and **CSS** (style/layout) through the Document Object Model (DOM).\n"", ""justification"": ""**Justification:** The answer provides a basic overview of the purpose of JavaScript in enriching web pages with interactivity and dynamic behavior.\n\n**Score:** 7/10"", ""score"": 0.0}, {""question"": ""Explain the concept of responsive design and how it applies to front-end development."", ""answer"": ""**Responsive design** is an approach in front-end development that ensures a website adapts its layout and elements to different screen sizes and devices (desktop, tablet, mobile) using techniques like fluid grids, flexible images, and CSS media queries.\n"", ""justification"": ""**Justification:** The answer provides a basic definition of responsive design, but it lacks depth and fails to explain the underlying principles and techniques involved.\n\n**Score:** 6/10"", ""score"": 0.0}, {""question"": ""Describe a common front-end framework like Bootstrap and its benefits and drawbacks."", ""answer"": ""**Bootstrap** is a popular front-end framework that provides pre-built HTML, CSS, and JavaScript components for building responsive and mobile-first websites.\n\n* **Benefits**: Speeds up development, ensures responsive design, has consistent styling, and includes many ready-to-use components.\n* **Drawbacks**: Can lead to a “generic” look if not customized, adds extra code bloat, and may limit design flexibility.\n"", ""justification"": ""Provides pre-built components for faster development, ensures responsive design, and includes ready-to-use styles."", ""score"": 8.0}, {""question"": ""Explain the difference between static and dynamic content in HTML and how they are handled by the browser."", ""answer"": ""**Static content** in HTML is fixed (like plain text or images) and always looks the same to every user, while **dynamic content** is generated or updated in real-time (e.g., via JavaScript or server-side scripts) and can change based on user interaction or data; the browser directly renders static content but executes scripts or fetches server responses to display dynamic content.\n"", ""justification"": ""The answer provides a basic distinction between static and dynamic content, but it could be improved by providing specific examples for each type of content."", ""score"": 7.0}, {""question"": ""Describe a real-world scenario where you would use HTML, CSS, and JavaScript to create a simple web page."", ""answer"": ""A **personal portfolio website** is a real-world scenario:\n\n* **HTML** structures the content (sections like About, Projects, Contact).\n* **CSS** styles it (colors, fonts, layouts, responsive design).\n* **JavaScript** adds interactivity (form validation, project sliders, or smooth scrolling).\n"", ""justification"": ""The candidate provides a clear description of the HTML, CSS, and JavaScript used to create a simple web page."", ""score"": 8.0}, {""question"": ""Explain the importance of accessibility in front-end development and how you would ensure an accessible website."", ""answer"": ""Accessibility in front-end development ensures that websites are usable by people with disabilities (e.g., visual, auditory, motor, or cognitive)."", ""justification"": ""**Justification:** The candidate's answer correctly defines accessibility in front-end development.\n\n**Score:** 8/10"", ""score"": 0.0}, {""question"": ""Describe a common front-end performance optimization technique and how it can improve website speed."", ""answer"": ""A common front-end optimization technique is **minifying and compressing CSS, JavaScript, and HTML files**, which removes unnecessary spaces, comments, and characters; this reduces file size, improves load times, and speeds up overall website performance.\n"", ""justification"": ""A common front-end optimization technique is minifying and compressing CSS, JavaScript, and HTML files, which removes unnecessary spaces, comments, and characters; this reduces file size, improves load times, and speeds up overall website performance."", ""score"": 8.0}, {""question"": ""Explain the difference between single-page applications (SPAs) and traditional websites and their advantages and disadvantages."", ""answer"": ""**Traditional websites** load a new HTML page from the server on each navigation, while **Single-Page Applications (SPAs)** load a single HTML page and dynamically update content using JavaScript without full page reloads.\n\n* **SPAs Advantages**: Faster navigation, smoother user experience, reduced server load.\n\n* **SPAs Disadvantages**: SEO challenges, larger initial load, higher reliance on JavaScript.\n\n* **Traditional Websites Advantages**: Better SEO, simpler to build, works without heavy JavaScript.\n\n* **Traditional Websites Disadvantages**: Slower navigation due to full page reloads, less app-like experience.\n"", ""justification"": ""The answer provides a clear distinction between SPAs and traditional websites, highlighting the differences in page loading, navigation, and SEO."", ""score"": 8.0}, {""question"": ""Describe a popular JavaScript library or framework that can be used for building interactive web applications."", ""answer"": ""**React** is a popular JavaScript library for building interactive web applications. It uses a **component-based architecture** and a **virtual DOM** to efficiently update only the parts of the UI that change.  \n\n- **Benefits**: Reusable components, fast rendering, strong community support, and easy integration with other tools.  \n- **Drawbacks**: Steep learning curve for beginners, requires additional libraries for full functionality (like routing or state management).  "", ""justification"": ""React is a widely used JavaScript library for building interactive web applications due to its component-based architecture and virtual DOM, which efficiently updates only the necessary parts of the UI."", ""score"": 8.0}]",2025-08-27T18:31:46.482024
20250827185744,sdasds asdasd,dasd@gmail.com,software enginer,python,19,"[{""question"": ""Describe the difference between static and dynamic programming in the context of Python."", ""answer"": ""ddddddddddddddd"", ""justification"": ""The candidate's answer is correct, but it is not comprehensive. It only mentions the terms 'static' and 'dynamic' without providing a clear distinction between them."", ""score"": 6.0}, {""question"": ""Explain the purpose of using a virtual environment in Python development."", ""answer"": ""dddddddddddddddddd"", ""justification"": ""**Justification:** A virtual environment allows you to run your Python code in a separate isolated environment, separate from the system's Python installation. This helps to avoid conflicts and ensure"", ""score"": 0.0}, {""question"": ""How would you implement a basic queue data structure using a Python data structure?"", ""answer"": ""sssssssssssssssssssssss"", ""justification"": ""**Justification:** The candidate's answer provides a list of characters, which is not a valid data structure for a queue.\n\n**Score:** 3/10"", ""score"": 0.0}, {""question"": ""Discuss the role of libraries like NumPy and Pandas in data manipulation and analysis in Python."", ""answer"": ""wwwwwwwwwwwwwwwww"", ""justification"": ""**Justification:** The candidate's answer provides a basic overview of the role of libraries like NumPy and Pandas in data manipulation and analysis in Python.\n\n**Score:** 7/10\n\n**Additional Notes:**\n"", ""score"": 0.0}, {""question"": ""Describe the difference between recursion and iteration in Python."", ""answer"": ""eeeeeeeeeeeeeeee"", ""justification"": ""The candidate's answer is partially correct, but it lacks a clear distinction between recursion and iteration in Python."", ""score"": 6.0}, {""question"": ""Explain the concept of garbage collection in Python and how it affects memory management."", ""answer"": ""fffffffffffffffffff"", ""justification"": ""**Justification:** The candidate's answer provides a basic definition of garbage collection but lacks depth and does not address the specific impact on memory management.\n\n**Score:** 6/10\n\n**Additiona"", ""score"": 0.0}, {""question"": ""How would you design a simple web server in Python using Flask or Django?"", ""answer"": ""hhhhhhhhhhhhhh"", ""justification"": ""**Justification:** The candidate's answer is partially correct. It mentions the use of Flask or Django, but it lacks specific details about the design itself.\n\n**Score:** 6/10"", ""score"": 0.0}, {""question"": ""Describe the principles of object-oriented programming in Python."", ""answer"": ""eeeeeeeeeeeeeeee"", ""justification"": ""**Justification:** The candidate's answer provides a basic overview of the principles of object-oriented programming in Python.\n\n**Score:** 6/10"", ""score"": 0.0}, {""question"": ""Explain the difference between abstract classes and interfaces in Python."", ""answer"": ""aaaaaaaaaaaaaaaa"", ""justification"": ""Abstract classes and interfaces are both abstract classes in Python, but they have different purposes and mechanisms."", ""score"": 7.0}, {""question"": ""Discuss the use of exceptions in Python and how they are handled."", ""answer"": ""hhhhhhhhhhhhhhhhh"", ""justification"": ""**Justification:** The candidate's answer provides a basic overview of exceptions in Python, mentioning their ability to handle errors and provide alternative execution paths.\n\n**Score:** 6/10"", ""score"": 0.0}]",2025-08-27T18:59:15.873943
20250827191448,abhihse asdas,asdas@asdas.com,software devlopemnet,sql,4,"[{""question"": ""Describe the difference between a relational database and a NoSQL database and give an example of each."", ""answer"": ""qweqweqweqwe"", ""justification"": ""Keyword overlap: 0.00/10, Semantic similarity: 1.08/10"", ""score"": 0.54}, {""question"": ""Explain the purpose of data normalization and how it can improve data integrity."", ""answer"": ""adadasdasd"", ""justification"": ""Keyword overlap: 0.00/10, Semantic similarity: 0.83/10"", ""score"": 0.42}, {""question"": ""Discuss the different types of indexes and how they are used to optimize data retrieval."", ""answer"": ""asdasdasdsa"", ""justification"": ""Keyword overlap: 0.00/10, Semantic similarity: 0.85/10"", ""score"": 0.43}, {""question"": ""Explain the difference between a primary key and a foreign key and give an example of each."", ""answer"": ""assdasdasd"", ""justification"": ""Keyword overlap: 0.00/10, Semantic similarity: 0.45/10"", ""score"": 0.22}, {""question"": ""Describe the different types of data validation and how they are used to ensure data quality."", ""answer"": ""asdasdasd"", ""justification"": ""Keyword overlap: 0.00/10, Semantic similarity: 0.51/10"", ""score"": 0.26}, {""question"": ""Explain the difference between a transaction and a commit and give an example of each."", ""answer"": ""asdasdasd"", ""justification"": ""Keyword overlap: 0.00/10, Semantic similarity: 0.87/10"", ""score"": 0.43}, {""question"": ""Discuss the different types of concurrency control mechanisms and give an example of each."", ""answer"": ""asdasdas"", ""justification"": ""Keyword overlap: 0.00/10, Semantic similarity: 0.40/10"", ""score"": 0.2}, {""question"": ""Describe the difference between a server and a client and give an example of each."", ""answer"": ""asdasdasd"", ""justification"": ""Keyword overlap: 0.00/10, Semantic similarity: 0.56/10"", ""score"": 0.28}, {""question"": ""Explain the difference between a database and a cache and give an example of each."", ""answer"": ""asdasdasd"", ""justification"": ""Keyword overlap: 0.00/10, Semantic similarity: 0.92/10"", ""score"": 0.46}, {""question"": ""Describe the different types of software testing and give an example of each."", ""answer"": ""asdasd"", ""justification"": ""Keyword overlap: 0.00/10, Semantic similarity: 0.64/10"", ""score"": 0.32}]",2025-08-27T19:15:34.455405
20250827191652,nishi cahda,asdklakndkw@9.com,CEO,phyton,3,"[{""question"": ""Describe the purpose of the Phyton framework and how it integrates with the Python programming language."", ""answer"": ""123yes"", ""justification"": ""Keyword overlap: 0.00/10, Semantic similarity: 0.00/10"", ""score"": 0.0}, {""question"": ""Explain the difference between a virtual environment and a package manager in the context of Phyton."", ""answer"": ""0no"", ""justification"": ""Keyword overlap: 0.00/10, Semantic similarity: 0.00/10"", ""score"": 0.0}, {""question"": ""Discuss the role of the SQLAlchemy module in the Phyton data modeling process."", ""answer"": ""no"", ""justification"": ""Keyword overlap: 0.00/10, Semantic similarity: 0.00/10"", ""score"": 0.0}, {""question"": ""Explain the concept of dependency injection and how it's implemented in Phyton."", ""answer"": ""yes"", ""justification"": ""Keyword overlap: 0.00/10, Semantic similarity: 0.00/10"", ""score"": 0.0}, {""question"": ""Describe the purpose of unit testing in the Phyton project lifecycle and how it's integrated with the development process."", ""answer"": ""no "", ""justification"": ""Keyword overlap: 0.00/10, Semantic similarity: 0.00/10"", ""score"": 0.0}, {""question"": ""Explain the role of the Celery worker in the Phyton application architecture."", ""answer"": ""asdadwef"", ""justification"": ""Keyword overlap: 0.00/10, Semantic similarity: 1.05/10"", ""score"": 0.53}, {""question"": ""Discuss the principles of thread safety and how they are implemented in Phyton."", ""answer"": ""aklls"", ""justification"": ""Keyword overlap: 0.00/10, Semantic similarity: 0.52/10"", ""score"": 0.26}, {""question"": ""Describe the use of asynchronous programming in Phyton and how it enables concurrent task execution."", ""answer"": ""asdflkjh"", ""justification"": ""Keyword overlap: 0.00/10, Semantic similarity: 2.02/10"", ""score"": 1.01}, {""question"": ""Explain the purpose of the logging module in the Phyton project and how it's used for error tracking and performance monitoring."", ""answer"": ""llll"", ""justification"": ""Keyword overlap: 0.00/10, Semantic similarity: 0.13/10"", ""score"": 0.07}, {""question"": ""Discuss the role of the configuration management system (e.g., ConfigParser) in the Phyton project and how it's used to define and load application settings."", ""answer"": ""asdwefw"", ""justification"": ""Keyword overlap: 0.00/10, Semantic similarity: 1.72/10"", ""score"": 0.86}]",2025-08-27T19:17:51.969123
20250827192333,abhishek wii,sdas@gmail.com,manager,"sql, .net",1,"[{""question"": ""Explain the difference between SQL and .NET in the context of data access."", ""answer"": ""aaaaaaaaaaaaaaaaaaaaaaaaaaaaaaaaaaaaaaaaaaaaaaaaaaaaaaaaaaaaaaaaaaaaaaaaaaaaaaaaaaaaaaaaaaaaaaaaaaaaaaaaaaaaaaaaaaaaaaaaaaaaaaaaaaaaaaaaaaaaa"", ""justification"": ""Keyword overlap: 0.00/10, Semantic similarity: 0.00/10"", ""score"": 0.0}, {""question"": ""Describe the purpose of a database and how it's used in the tech stack you mentioned."", ""answer"": ""sssssssssssssssssssssssssssssssssssssssssssssssssssssssssssssssssssssssssssssssssssssssssssssssssssssssssssssssssssss"", ""justification"": ""Keyword overlap: 0.00/10, Semantic similarity: 0.08/10"", ""score"": 0.04}, {""question"": ""What are the different types of data access patterns and how would you choose the right one for a specific scenario?"", ""answer"": ""rrrrrrrrrrrrrrrrrrrrrrrrrrrrrrrrrrrrrrrrrrrrrrrrrrrrrrrrrrrrrrrrrrrrrrrrrrrrrrrrrrrrrrrrrrrrrrrrrrrrrrrrrrrrrrrrrrrrrrrr"", ""justification"": ""Keyword overlap: 0.00/10, Semantic similarity: 0.00/10"", ""score"": 0.0}, {""question"": ""Explain the difference between a relational database and a NoSQL database and give an example of each."", ""answer"": ""uuuuuuuuuuuuuuuuuuuuuuuuuuuuuuuuuuuuuuuuuuuuuuuuuuuuuuuuuuuuuuuuuuuuuuuuuuuuuuuuuuuuuuuuuuuuuuu"", ""justification"": ""Keyword overlap: 0.00/10, Semantic similarity: 0.00/10"", ""score"": 0.0}, {""question"": ""Describe the concept of normalization in database design and how it helps maintain data integrity."", ""answer"": ""wwwwwwwwwwwwwwwwwwwwwwwwwwwwwwwwwwwwwwwwwwwwwwwwwwwwwwwwwwwwwwwwwwwwwwwwwwwwwwwwwwwwwwwwwwwwwwwwwwwwwwwwww"", ""justification"": ""Keyword overlap: 0.00/10, Semantic similarity: 0.37/10"", ""score"": 0.18}, {""question"": ""Explain the difference between a primary key and a foreign key in a database and give an example of each."", ""answer"": ""iiiiiiiiiiiiiiiiiiiiiiiiiiiiiiiiiiiiiiiiiiiiiiiiiiiiiiiiiiiiiiiiiiiiiiiiiiiiiiiiiiiiiiiiiiiiiiiiiiiiiiiiiiiiiiiiiiiiiiiiiiiiiiiiiiiiiiiiiiiiiii"", ""justification"": ""Keyword overlap: 0.00/10, Semantic similarity: 0.24/10"", ""score"": 0.12}, {""question"": ""Describe the purpose of caching in a database and how it can improve performance."", ""answer"": ""vvvvvvvvvvvvvvvvvvvvvvvvvvvvvvvvvvvvvvvvvvvvvvvvvvvvvvvvvvvvvvvvvvvvvvvvvvvvvvvvvvvvvvvvvvvvvvvvv"", ""justification"": ""Keyword overlap: 0.00/10, Semantic similarity: 0.29/10"", ""score"": 0.14}, {""question"": ""Explain the difference between a thread and a process in the context of multithreading and its importance in .NET."", ""answer"": ""llllllllllllllllllllllllllllllllllllllllllllllllllllllllllllllllllllllllllllllllllll"", ""justification"": ""Keyword overlap: 0.00/10, Semantic similarity: 0.63/10"", ""score"": 0.32}, {""question"": ""Describe the different types of exceptions in .NET and how they are handled."", ""answer"": ""uuuuuuuuuuuuuuuuuuuuuuuuuuuuuuuuuuuuuuuuuuuuuuuuuuuuuuuuuuuuu"", ""justification"": ""Keyword overlap: 0.00/10, Semantic similarity: 0.00/10"", ""score"": 0.0}, {""question"": ""Explain the difference between a managed and unmanaged environment in .NET and give an example of each."", ""answer"": ""wwwwwwwwwwwwwwwwwwwwwwwwwwwwwwwwwwwwwwwwwwwwwwwwwwwwwwwwwwww"", ""justification"": ""Keyword overlap: 0.00/10, Semantic similarity: 0.00/10"", ""score"": 0.0}]",2025-08-27T19:24:44.583794
